<?xml version="1.0" encoding="UTF-8"?>
<flowers xmlns:xsi="http://www.w3.org/2001/XMLSchema-instance"
        xmlns="http://www.example.org/flowers"
        xsi:schemaLocation="http://www.example.org/flowers flowers.xsd">
    <time-flower id="flw1" origin="China" >
        <name>rose</name>
        <soil>unpaved</soil>
        <visual-parameters>
            <stem-color>light-green</stem-color>
            <leaf-color>dark-green</leaf-color>
            <average-size>60</average-size>
        </visual-parameters>
        <growing-tips>
            <temperature>20</temperature>
            <lightning>true</lightning>
            <watering>1400</watering>
        </growing-tips>
        <multiplying>stalk</multiplying>
        <transfer-time>2002-05-30T09:00:00</transfer-time>
    </time-flower>
    <time-flower id="flw2" origin="Iran" >
        <name>tulip</name>
        <soil>podzol</soil>
        <visual-parameters>
            <stem-color>medium-green</stem-color>
            <leaf-color>medium-green</leaf-color>
            <average-size>30</average-size>
        </visual-parameters>
        <growing-tips>
            <temperature>18</temperature>
            <lightning>true</lightning>
            <watering>1200</watering>
        </growing-tips>
        <multiplying>seed</multiplying>
        <transfer-time>2002-05-30T09:00:09</transfer-time>
    </time-flower>
    <time-flower id="flw3" origin="Russia" >
        <name>sunflower</name>
        <soil>podzol</soil>
        <visual-parameters>
            <stem-color>medium-green</stem-color>
            <leaf-color>medium-green</leaf-color>
            <average-size>100</average-size>
        </visual-parameters>
        <growing-tips>
            <temperature>20</temperature>
            <lightning>true</lightning>
            <watering>600</watering>
        </growing-tips>
        <multiplying>seed</multiplying>
        <transfer-time>2019-03-10T09:00:00</transfer-time>
    </time-flower>
    <time-flower id="flw4" origin="Belarus" >
        <name>cornflower</name>
        <soil>sodpodzol</soil>
        <visual-parameters>
            <stem-color>dark-green</stem-color>
            <leaf-color>medium-green</leaf-color>
            <average-size>70</average-size>
        </visual-parameters>
        <growing-tips>
            <temperature>21</temperature>
            <lightning>true</lightning>
            <watering>500</watering>
        </growing-tips>
        <multiplying>seed</multiplying>
        <transfer-time>2019-03-10T09:00:00</transfer-time>
    </time-flower>
    <time-flower id="flw5" origin="Greece" >
        <name>violet</name>
        <soil>sodpodzol</soil>
        <visual-parameters>
            <stem-color>dark-green</stem-color>
            <leaf-color>dark-green</leaf-color>
            <average-size>5</average-size>
        </visual-parameters>
        <growing-tips>
            <temperature>24</temperature>
            <lightning>true</lightning>
            <watering>600</watering>
        </growing-tips>
        <multiplying>liaf</multiplying>
        <transfer-time>2019-03-10T09:00:20</transfer-time>
    </time-flower>
    <time-flower id="flw6" origin="Tunis" >
        <name>carnation</name>
        <soil>unpaved</soil>
        <visual-parameters>
            <stem-color>dark-green</stem-color>
            <leaf-color>dark-green</leaf-color>
            <average-size>50</average-size>
        </visual-parameters>
        <growing-tips>
            <temperature>25</temperature>
            <lightning>true</lightning>
            <watering>500</watering>
        </growing-tips>
        <multiplying>stalk</multiplying>
        <transfer-time>2019-03-10T09:00:21</transfer-time>
    </time-flower>
    <time-flower id="flw7" origin="America" >
        <name>spathiphyllum</name>
        <soil>sodpodzol</soil>
        <visual-parameters>
            <stem-color>medium-green</stem-color>
            <leaf-color>dark-green</leaf-color>
            <average-size>30</average-size>
        </visual-parameters>
        <growing-tips>
            <temperature>23</temperature>
            <lightning>false</lightning>
            <watering>1200</watering>
        </growing-tips>
        <multiplying>stalk</multiplying>
        <transfer-time>2020-03-10T09:00:00</transfer-time>
    </time-flower>
    <time-flower id="flw8" origin="China" >
        <name>aster</name>
        <soil>sodpodzol</soil>
        <visual-parameters>
            <stem-color>dark-green</stem-color>
            <leaf-color>dark-green</leaf-color>
            <average-size>40</average-size>
        </visual-parameters>
        <growing-tips>
            <temperature>20</temperature>
            <lightning>true</lightning>
            <watering>1500</watering>
        </growing-tips>
        <multiplying>seed</multiplying>
        <transfer-time>2021-03-10T09:00:00</transfer-time>
    </time-flower>
    <time-flower id="flw9" origin="Belarus" >
        <name>maylily</name>
        <soil>podzol</soil>
        <visual-parameters>
            <stem-color>dark-green</stem-color>
            <leaf-color>dark-green</leaf-color>
            <average-size>10</average-size>
        </visual-parameters>
        <growing-tips>
            <temperature>21</temperature>
            <lightning>false</lightning>
            <watering>800</watering>
        </growing-tips>
        <multiplying>seed</multiplying>
        <transfer-time>2021-03-15T09:00:00</transfer-time>
    </time-flower>
    <time-flower id="flw10" origin="Belarus" >
        <name>snowdrop</name>
        <soil>sodpodzol</soil>
        <visual-parameters>
            <stem-color>medium-green</stem-color>
            <leaf-color>dark-green</leaf-color>
            <average-size>10</average-size>
        </visual-parameters>
        <growing-tips>
            <temperature>15</temperature>
            <lightning>false</lightning>
            <watering>1200</watering>
        </growing-tips>
        <multiplying>seed</multiplying>
        <transfer-time>2021-03-20T09:00:00</transfer-time>
    </time-flower>
    <time-flower id="flw11" origin="Belarus" >
        <name>chamomile</name>
        <soil>sodpodzol</soil>
        <visual-parameters>
            <stem-color>medium-green</stem-color>
            <leaf-color>dark-green</leaf-color>
            <average-size>10</average-size>
        </visual-parameters>
        <growing-tips>
            <temperature>23</temperature>
            <lightning>true</lightning>
            <watering>900</watering>
        </growing-tips>
        <multiplying>seed</multiplying>
        <transfer-time>2021-03-10T10:00:00</transfer-time>
    </time-flower>
    <time-flower id="flw12" origin="Russia" >
        <name>lotus</name>
        <soil>unpaved</soil>
        <visual-parameters>
            <stem-color>dark-green</stem-color>
            <leaf-color>dark-green</leaf-color>
            <average-size>300</average-size>
        </visual-parameters>
        <growing-tips>
            <temperature>15</temperature>
            <lightning>false</lightning>
            <watering>10000</watering>
        </growing-tips>
        <multiplying>seed</multiplying>
        <transfer-time>2021-04-10T09:00:00</transfer-time>
    </time-flower>
    <time-flower id="flw13" origin="America" >
        <name>pansy</name>
        <soil>unpaved</soil>
        <visual-parameters>
            <stem-color>dark-green</stem-color>
            <leaf-color>dark-green</leaf-color>
            <average-size>5</average-size>
        </visual-parameters>
        <growing-tips>
            <temperature>23</temperature>
            <lightning>true</lightning>
            <watering>800</watering>
        </growing-tips>
        <multiplying>seed</multiplying>
        <transfer-time>2022-03-10T09:00:00</transfer-time>
    </time-flower>
    <time-flower id="flw14" origin="America" >
        <name>orchid</name>
        <soil>sodpodzol</soil>
        <visual-parameters>
            <stem-color>light-green</stem-color>
            <leaf-color>medium-green</leaf-color>
            <average-size>10</average-size>
        </visual-parameters>
        <growing-tips>
            <temperature>25</temperature>
            <lightning>true</lightning>
            <watering>100</watering>
        </growing-tips>
        <multiplying>seed</multiplying>
        <transfer-time>2021-03-10T09:00:00</transfer-time>
    </time-flower>
    <time-flower id="flw15" origin="Belarus" >
        <name>gladiolus</name>
        <soil>podzol</soil>
        <visual-parameters>
            <stem-color>light-green</stem-color>
            <leaf-color>light-green</leaf-color>
            <average-size>40</average-size>
        </visual-parameters>
        <growing-tips>
            <temperature>24</temperature>
            <lightning>true</lightning>
            <watering>1000</watering>
        </growing-tips>
        <multiplying>seed</multiplying>
        <transfer-time>2024-03-10T09:00:00</transfer-time>
    </time-flower>
    <time-flower id="flw16" origin="Belarus" >
        <name>lavender</name>
        <soil>sodpodzol</soil>
        <visual-parameters>
            <stem-color>dark-green</stem-color>
            <leaf-color>dark-green</leaf-color>
            <average-size>80</average-size>
        </visual-parameters>
        <growing-tips>
            <temperature>20</temperature>
            <lightning>true</lightning>
            <watering>1900</watering>
        </growing-tips>
        <multiplying>stalk</multiplying>
        <transfer-time>2021-03-10T09:00:01</transfer-time>
    </time-flower>
</flowers>